id,created_at,text926062200288153601,2017-11-02 12:23:28,b'10 Social Engineering Attacks Your End Users Need to Know About https://t.co/AOo7oEcQrz #socialengineering'
925916784993144832,2017-11-02 02:45:38,b'Average Employee Manages Nearly 200 Passwords https://t.co/sj7vOviPD0'
925871517447131137,2017-11-01 23:45:46,b'Will New Ownership Open New Opportunities For Digital Cert Vendors? https://t.co/hYkxeZ3jfa'
925841362662187008,2017-11-01 21:45:56,"b""'Silence' Trojan Mimics Carbanak to Spy, Steal from Banks https://t.co/dMechhAUUU"""
925821404225916929,2017-11-01 20:26:38,b'The dangers of not employing EAP-TLS wireless security:  https://t.co/QX5c3lOKSQ via @jaivijayan'
925796151760162818,2017-11-01 18:46:17,"b'iPhone 7, Samsung Galaxy S8, Others Hacked in Pwn2Own https://t.co/gEOU2tba2v'"
925792207478640641,2017-11-01 18:30:37,b'Greig Arnold of @Optiv   will discuss war stories from the CISOs office at #INsecurityCon. Don\xe2\x80\x99t miss out!\xe2\x80\xa6 https://t.co/8Z7eiUxcyU'
925764430213853186,2017-11-01 16:40:14,b'It\xe2\x80\x99s Time to Change the #Cybersecurity Conversation https://t.co/diUicEs9IS\n\n#INsecurityCon @darkreadingtim'
925753111347695616,2017-11-01 15:55:16,b'How Wireless Intruders Can Bypass NAC Controls https://t.co/JcP7voDLMQ @sectorca'
925746900783042560,2017-11-01 15:30:35,"b'Sometimes, the best way to develop your own incident plan is to see how others do it. https://t.co/7mWt0zuU32\xe2\x80\xa6 https://t.co/gPykqv0KQW'"
925735690167640067,2017-11-01 14:46:02,b'How AI Can Help Prevent Data Breaches in 2018 and Beyond https://t.co/f6dVCliSEU'
925735690029105152,2017-11-01 14:46:02,b'How Wireless Intruders Can Bypass NAC Controls https://t.co/JcP7voDLMQ'
925722995401920513,2017-11-01 13:55:35,"b""You've only got a month. Don't let it slip by. Get your #INsecurityCon pass now: https://t.co/dBbMZN8vJK"""
925485382942298113,2017-10-31 22:11:24,b'10 Security Product Flaw Scares: Happy Halloween edition https://t.co/DWREESdUMC https://t.co/Kjgc8T3O34'
925482887243292672,2017-10-31 22:01:29,"b'Office 365 Missed 34,000 Phishing Emails Last Month https://t.co/bCu6KJBthb #O365 #Microsoft'"
925456626383032321,2017-10-31 20:17:08,b'Think Your Phone is Safe from Hacking? #ResearchReport from @Privorodescribes consumer views on mobile surveillance https://t.co/LLQzfYsazU'
925455711714398208,2017-10-31 20:13:30,b'How Upwork Cut #Zero-Day File #Attacks by 70%: On Demand Webinar from @OPSWAT https://t.co/Y9i4MNx2EK'
925453492650733568,2017-10-31 20:04:41,"b'State of #Ransomware: Researchers asked 220 IT security pros about defense plans, malware challenges https://t.co/XiEx4MDRa5 from @GoIvanti'"
925451116338384897,2017-10-31 19:55:14,"b""ICYMI: #Ransomware: NewDevelopments/How 2 Defend Against Them&gt; Webinar w  @Shpantzer &amp; @RecordedFuture's Allan Liska https://t.co/o4VtsNFNoA"""
925448691598675968,2017-10-31 19:45:36,b'North Korea Faces Accusations of Hacking Into Warship Builder Daewoo https://t.co/Ri6LrzHBTu'
925448691569192960,2017-10-31 19:45:36,"b'Office 365 Missed 34,000 Phishing Emails Last Month https://t.co/Zml5Z0Uobb'"
925448085391773696,2017-10-31 19:43:12,"b""Cybersecurity Architecture to Combat Today\xe2\x80\x99s Risks: #OnDemand  #Webinar w @Shpantzer &amp; @LogRhythm's Erik Bartholomy https://t.co/K5WD5k0HmP"""
925442871154696192,2017-10-31 19:22:29,"b'We scared up our stories most shared on Facebook, Twitter, and LinkedIn. https://t.co/MIbqvlAZaK #social https://t.co/o1buynumgP'"
925434175636803585,2017-10-31 18:47:55,"b""Paying ransom in a ransomware attack isn't recommended, but when the situation is fraught, here's how to pay:  https://t.co/Jp6mJ2FtHN"""
925433734463188993,2017-10-31 18:46:10,"b""Who Says Brilliant Security Engineers Can't Be Amazing People Managers? https://t.co/1X1ZDMfuSt"""
925433734127587329,2017-10-31 18:46:10,b'Trump Administration to Craft New Cybersecurity Plan https://t.co/z0ygbVDDYW'
925415875158708225,2017-10-31 17:35:12,b'Check out these hot topic spotlights at #INsecurityCon: https://t.co/TjqkrUuweJ https://t.co/l96qdczrQD'
925403425889837057,2017-10-31 16:45:44,b'How to Make a Ransomware Payment - Fast https://t.co/IK4wM72Iq5'
925388375619784704,2017-10-31 15:45:56,b'10 Scariest Ransomware Attacks of 2017 https://t.co/mzwudST1t2'
925384571855736832,2017-10-31 15:30:49,"b'Join Senior VP of @Aon_plc, Eric Seyfried, as he discusses #cyberinsurance at #INsecurityCon. Get more info:\xe2\x80\xa6 https://t.co/NMlSoDOAkP'"
925373278470000640,2017-10-31 14:45:56,b'Phishing Kits Regularly Reused by Cybercriminals https://t.co/IyiXaW9h5C'
925373277706555393,2017-10-31 14:45:56,b'Stop Counting Vulnerabilities &amp; Start Measuring Risk https://t.co/BERpvx1BET'
925358566315384833,2017-10-31 13:47:29,b'Defending against Account Compromise with Authentication Insights https://t.co/2Qo4Anlk9M'
925358149049159682,2017-10-31 13:45:49,b'Happy Halloween from #INsecurityCon! Now through Nov 7 take $200 off your conference pass. Use code HOWL at checkou\xe2\x80\xa6 https://t.co/yyLku5hqSh'
925348316765925378,2017-10-31 13:06:45,b'@Singha_Ra Thanks for the catch. The report link is now fixed.'
925343215565332485,2017-10-31 12:46:29,b'Majority of Employees Hit with Ransomware Personally Make Payment https://t.co/CNH9D5Y06O'
925342386112356352,2017-10-31 12:43:11,b'The Dark Reading Cartoon Contest Winner is... https://t.co/LaIAT7XKYx'
925341075258175491,2017-10-31 12:37:59,"b'RT @kjhiggins: Interesting: @LinkedIn was one of the main social media platforms sharing security content, Not just @Twitter:  https://t.co\xe2\x80\xa6'"
925147337822961664,2017-10-30 23:48:08,"b'@DanielMiessler  Thanks for your note. While our site is HTTPS, our image server is in the process of being converted to HTTPS.'"
925131563964264448,2017-10-30 22:45:27,"b'Gaza Cybergang Acquires New Tools, Expands Operations https://t.co/erIBz2KUhP'"
925116554169192450,2017-10-30 21:45:49,b'Google Bug Database Flaws Expose Severe Vulnerabilities https://t.co/j2rezpO8se'
925101393526083585,2017-10-30 20:45:34,"b""Security Gets Social: 10 of Dark Reading's Most Shared Stories https://t.co/VwSxtaqqrG"""
925081309210431488,2017-10-30 19:25:45,b'A look at the major cloud security slip-ups so far this year: https://t.co/0oZ569Pc68 \n#cloud #AWS'
925075211422261249,2017-10-30 19:01:32,b'See what #INsecurityCon has in store this November: https://t.co/4vOrOwxYx8\n\n#EnterpriseSecurity #DarkReading https://t.co/T78j7SwDPq'
925045034440904704,2017-10-30 17:01:37,b'How are #security leaders solving some of the greatest online security challenges?\nhttps://t.co/Hot9Cnwaqs\xe2\x80\xa6 https://t.co/CvNRwHLkuj'
925041002414575616,2017-10-30 16:45:36,b'Kaspersky Expects US Sales to Decline in 2017 https://t.co/J1hag6rEOw'
925025983954026499,2017-10-30 15:45:55,b'Screen Sharing: Dark Reading Caption Contest Winners https://t.co/fCfF7Vrfjh'
925019462520143873,2017-10-30 15:20:00,b'10 Free or Low-Cost Security Tools https://t.co/3VZW4yqruw'
925017992219545601,2017-10-30 15:14:10,b'Web Attacks Spike in Financial Industry: 1/3 of breach events in 2017 https://t.co/Iq736B2ubI'
925010778956206081,2017-10-30 14:45:30,b'Preventing Credential Theft: A Security Checklist for Boards https://t.co/yqiaHyLe1X'
924989404418101248,2017-10-30 13:20:34,b'Windows 10 Update: Key New Security Features  https://t.co/a6sJfJk7Lv #Windows10 #Microsoft https://t.co/Jsu8SNeTbx'
924988106973106176,2017-10-30 13:15:24,"b""November's getting closer! Buy your #INsecurityCon pass now:\nhttps://t.co/XEQIP0NJ8S"""
924980795223232512,2017-10-30 12:46:21,"b""It's Time to Change the Cybersecurity Conversation https://t.co/a7uapsidbu"""
924686064236875776,2017-10-29 17:15:12,b'#INsecurityCon is only a month away! Get your pass before time runs out: https://t.co/CcPnAMJs5R'
924014218466283525,2017-10-27 20:45:31,b'Web Attacks Spike in Financial Industry https://t.co/qTWLDk0zkx'
924014218403368961,2017-10-27 20:45:31,b'Identity Theft Ring Hit with Credit Card Fraud Indictment https://t.co/cs1LwIDB9C'
924009623794876416,2017-10-27 20:27:16,b'RT @DarkReading: In case you overrlooked this... 8 Most Overlooked Security Threats by @kellymsheridan https://t.co/ZjLqHJuT15'
924009544178651136,2017-10-27 20:26:57,b'Dark Web marketplaces pivot to new homes in mobile messaging apps: https://t.co/abSADkwLyI via @ErickaChick'
923992776408223746,2017-10-27 19:20:19,b'In case you overrlooked this... 8 Most Overlooked Security Threats by @kellymsheridan https://t.co/ZjLqHJuT15'
923981734756147200,2017-10-27 18:36:26,b'Advice that bears repeating:  NIST Releases Cybersecurity Definitions for the Workforce https://t.co/sLVSa73nQb by @dawnkawamoto'
923980305077325824,2017-10-27 18:30:46,b'What are the challenges of the current and evolving threat landscape? Find out more at #INsecurityCon! @PhishMe\xe2\x80\xa6 https://t.co/NAasgaaUS5'
923979894173913088,2017-10-27 18:29:08,b'RT @DarkReading: Why Data Breach Stats Get It Wrong https://t.co/UkD66vW3bM'
923978819643609088,2017-10-27 18:24:51,b'ICYMI a good read by @ErickaChick Desperately Seeking Security: 6 Skills Most In Demand https://t.co/HpTYJDSugt'
923957951357911040,2017-10-27 17:01:56,"b""We're looking forward to seeing @cyxtera at INsecurity next month!\n\nhttps://t.co/nOIws6tm7z"""
923941661155184640,2017-10-27 15:57:12,b'@AccentureSecure @HSS_Sidhu| Developing A Security Outsourcing Strategy That Really Works at #INsecurityCon!\xe2\x80\xa6 https://t.co/rNVELvz4xJ'
923938889659797504,2017-10-27 15:46:11,b'3 Steps to Reduce Risk in Your Supply Chain https://t.co/dntyQhyV64'
923938857627811841,2017-10-27 15:46:04,b'Passwords Use Alone Still Trumps Multi-Factor Authentication https://t.co/slZpcSCtMR'
923932360122535936,2017-10-27 15:20:15,b'10 Steps for Stretching Your IT Security Budget https://t.co/i2kPegBdo3'
923682054788837378,2017-10-26 22:45:37,b'Inmarsat Disputes IOActive Reports of Critical Flaws in Ship SATCOM https://t.co/TgYMFr3Lah'
923666976916025345,2017-10-26 21:45:42,"b""'Reaper' IoT Botnet Likely a DDoS-for-Hire Tool https://t.co/J5UkD6C7rj"""
923666951750242305,2017-10-26 21:45:36,b'Security Forecast: Cloudy with Low Data Visibility https://t.co/GfaCUe3JqA'
923651807817207813,2017-10-26 20:45:26,"b""Dark Web Marketplaces' New Home: Mobile Messaging Apps https://t.co/Y6SRGi7stb"""
923651807792033800,2017-10-26 20:45:26,b'Bad Rabbit Used Pilfered NSA Exploit https://t.co/Qpqdp16fCm'
923636740929224705,2017-10-26 19:45:34,b'30% of Major CEOs Have Had Passwords Exposed https://t.co/f0erHoJquP'
923621854560112640,2017-10-26 18:46:24,b'Why Data Breach Stats Get It Wrong https://t.co/UkD66vW3bM'
923610564458360839,2017-10-26 18:01:33,"b'Join @FunCaptcha CEO @kgosschalk for, Why Are Plane Tickets So Expensive?, at #INsecurityCon next month!\xe2\x80\xa6 https://t.co/lvLtM3DzUW'"
923587705145085952,2017-10-26 16:30:42,"b'Join us in welcoming CEO of Echelon One, Bob West, to #INsecurityCon!\nhttps://t.co/DiIic3d5b8 https://t.co/hdEBIqKbQL'"
923561388479533056,2017-10-26 14:46:08,b'A Checklist for Securing the Internet of Things https://t.co/BgpuwZ1706'
923561388408270848,2017-10-26 14:46:08,b'5 Reasons Why the CISO is a Cryptocurrency Skeptic https://t.co/jitCQZ1c2T'
923548768435359744,2017-10-26 13:55:59,b'Windows 10 Update: 10 Key New Security Features https://t.co/487Ya7zm3p #Microsoft #Windows10 via @kellymsheridan'
923542560513159168,2017-10-26 13:31:19,"b""In the event of a #securitybreach what is your organization's liability? Discover More: https://t.co/YTW34hoDew\xe2\x80\xa6 https://t.co/nYwfFTsXHZ"""
923531195941572610,2017-10-26 12:46:10,b'Doubling Up on AV Fails to Protect 40% of Users from Malware Attacks https://t.co/egD0Ix8gGL'
923334708091637760,2017-10-25 23:45:23,"b'Kaspersky Lab Collected, Then Deleted NSA File from a Home Computer https://t.co/T2pCNjya7h'"
923328866923499520,2017-10-25 23:22:11,"b'Kaspersky Lab Collected, Then Deleted NSA File from a Home Computer https://t.co/xiKeAR9TUn'"
923325862904320001,2017-10-25 23:10:14,"b'RT @kjhiggins: Updated my story w/new info from RiskIQ that indicates #BadRabbit was part of ongoing, already existing campaign: \n https://\xe2\x80\xa6'"
923319634182463488,2017-10-25 22:45:29,b'Bad Rabbit Dies Down But Questions Remain https://t.co/SmQox9n7Au'
923304671522979841,2017-10-25 21:46:02,b'Windows 10 Update: 10 Key New Security Features https://t.co/487Ya7zm3p'
923284677254959106,2017-10-25 20:26:35,"b""Oops, we forgot to include a promo code in yesterday's offer. Use code FLY to take advantage of this special deal:\xe2\x80\xa6 https://t.co/fDiIuuh1by"""
923259343608401921,2017-10-25 18:45:55,b'Advanced Analytics + Frictionless Security: What CISOS Need to Know https://t.co/SekGJdwc3E'
923259343444856837,2017-10-25 18:45:55,"b""Third Man Charged in Hacking Celebrities' iCloud and Gmail Accounts https://t.co/m4rLXRmnS1"""
923239359796731905,2017-10-25 17:26:30,"b""Yes, patching is hard. Here's why and what to do about it:  https://t.co/rSesyvcUIw"""
923238029262716928,2017-10-25 17:21:13,b'10 Steps for Stretching Your IT Security Budget https://t.co/n1owB6X5PH'
923213985071157248,2017-10-25 15:45:41,"b'Productivity, Operations Hardest-Hit by Endpoint Attacks https://t.co/CzAk48O0wz'"
923213985058578439,2017-10-25 15:45:41,b'Why Patching Software Is Hard: Organizational Challenges https://t.co/Os2kM1RhL8'
923183122371530752,2017-10-25 13:43:02,b'RT @RutterNet: 10 Social Engineering Attacks Your End Users Need ... https://t.co/ZcfgIT8aa5 via @DarkReading'
923160396760080386,2017-10-25 12:12:44,b'RT @BADtesting: Why Patching Software Is Hard: Technical Challenges https://t.co/iCDsQRkjiI by @TeriRadichel via @DarkReading'
922927036003336192,2017-10-24 20:45:27,"b""'Bad Rabbit' Ransomware Attacks Rock Russia, Ukraine - and Beyond https://t.co/D0tmksFfRg"""
922925908360441858,2017-10-24 20:40:58,b'RT @kjhiggins: New Tool Debuts for Hacking Back at Hackers in Your Network https://t.co/jdoV75sfUG\nLegal hack-back or next-gen incident res\xe2\x80\xa6'
922908151900524544,2017-10-24 19:30:24,b'The upcoming  #INsecurityCon  speaking roster is full of #CISOs &amp; SOC directors. DR editor @sarapeters explains why\xe2\x80\xa6 https://t.co/aUWKQoRWTn'
922905276549918723,2017-10-24 19:18:59,b'@BWortonHunt  Thanks for the pointer!'
922899078484250624,2017-10-24 18:54:21,b'https://t.co/SZsXrPuFC8'
922896998558240768,2017-10-24 18:46:05,"b""New Cybercrime Insurance Policy Protects the 'High Net Worth' Set https://t.co/I63j6SnvKd"""
922896998507925506,2017-10-24 18:46:05,"b""Finding Your Appetite for Security Automation (and Why That's Important) https://t.co/Wmgqr5Z0qP"""
922896998214356992,2017-10-24 18:46:05,b'10 Steps for Stretching Your IT Security Budget https://t.co/bxxhrXYhKc'
922894678818684928,2017-10-24 18:36:52,b'10 Steps for Stretching Your IT Security Budget  https://t.co/f232DCb0EN https://t.co/MV9yN4PBqb'
922870576301080577,2017-10-24 17:01:06,"b'Join Federal Director of Cloud Security Alliance, for Tips and Tricks For #CloudSecurity at #INsecurityCon:\xe2\x80\xa6 https://t.co/xxwJBQx8XD'"
922853502560456704,2017-10-24 15:53:15,"b""Microsoft says Windows 10's new Defender Exploit Guard fights ransomware infections: https://t.co/pC2jmNtMwL via @kellymsheridan #Microsoft"""
922847772482686976,2017-10-24 15:30:29,"b'Just in time for the holiday season! Register &amp; pay for #INsecurityCon, get a free drone. https://t.co/71PiVn1FVA https://t.co/FuWYl7wqFx'"
922836519563481088,2017-10-24 14:45:46,"b'Opera, Vivaldi Co-Founder Talks Internet Privacy https://t.co/wrbjeGZ9q1'"
922836519525797889,2017-10-24 14:45:46,"b""One-Third of Businesses Can't Keep Up with Cloud Security https://t.co/AAppVxojqF"""
922836519458623488,2017-10-24 14:45:46,b'Why Patching Software Is Hard: Technical Challenges https://t.co/VsbpmlMAcC'
922828629733756929,2017-10-24 14:14:25,b'ICYMI: Best and Worst Security Functions to Outsource https://t.co/fqQsWMePfn #outsourcing'
922828005575184386,2017-10-24 14:11:56,"b'Speakers from the U.S. Gov, Carnegie Mellon &amp; Crowdstrike will be at #INsecurityCon next month. Will you? \n\nhttps://t.co/mcIS9LXidz'"
922821335792930816,2017-10-24 13:45:26,b'New Tool Debuts for Hacking Back at Hackers in Your Network https://t.co/LqHunftlMX'
922812338914385921,2017-10-24 13:09:41,b'New Tool Debuts for Hacking Back at Hackers in Your Network https://t.co/00B4u2fixR'
922580078554419200,2017-10-23 21:46:46,b'Kaspersky Lab Offers Up its Source Code for Inspection https://t.co/QGvHebXRkh'
922579820470468611,2017-10-23 21:45:44,b'Unpatched Bugs Rampant on Mobile Devices in Financial Services Firms https://t.co/uS6V4L9pdu'
922579820134977552,2017-10-23 21:45:44,b'US Critical Infrastructure Target of Russia-Linked Cyberattacks https://t.co/sPMXTTBmH5'
922579820084629504,2017-10-23 21:45:44,"b""Windows 10 Update Aims to Block Attackers' Behavior https://t.co/sw5PeVzWP6"""
922540664679751682,2017-10-23 19:10:09,"b""It's not too late to get rolling on GDPR compliance. Here's how to get started: https://t.co/W4Z5jJHUqh #GDPR via @sarapeters"""
922534609660858368,2017-10-23 18:46:05,b'Google Play Bug Bounty Program Debuts https://t.co/llAJsnZxtd'
922500718044631040,2017-10-23 16:31:25,b'Meet the 6 new cybersecurity startups getting up &amp; running via #Mach37 accelerator program: https://t.co/u0CRIX3Bq5'
922477877089759232,2017-10-23 15:00:39,"b'Heading to #INsecurityCon? Hear Don Boian, CISO of @Huntington_Bank, talk about hot topic, patch management:\xe2\x80\xa6 https://t.co/yt6AgGax2N'"
922474050609467393,2017-10-23 14:45:27,b'Security Training &amp; Awareness: 3 Big Myths https://t.co/BL0GxIQOFG'
922461767023726592,2017-10-23 13:56:38,b'10 Social Engineering Attacks Your End Users Need to Know About https://t.co/wIbBuGWeLg'
922457780614848512,2017-10-23 13:40:47,b'Thanks @kryptowire for joining #INsecurityCon 2017! See you next month: https://t.co/JkzZd1ntOu'
922121647280226306,2017-10-22 15:25:07,"b""We're excited to hear from so many great CISOs, Exec Directors, and more at #INsecurityCon next month! https://t.co/IVao73v8Pt"""
921766824827654144,2017-10-21 15:55:11,b'Think you have what it takes to defend against ANY kind of #cybersecurity breach?  https://t.co/83WSIbfDA7 #INsecurityCon'
921507713473015808,2017-10-20 22:45:34,b'Veracode: 75% Of Apps Have At Least One Vulnerability On Initial Scan https://t.co/C8vPPIO8ud'
921507713363992578,2017-10-20 22:45:34,b'IOTroop Botnet Hits Over a Million Organizations in Under 30 Days https://t.co/4aHOxFdPm9'
921477564413169665,2017-10-20 20:45:46,"b'The Week in Crypto: Bad News for SSH, WPA2, RSA &amp; Privacy https://t.co/nVjKEo6qHa'"
921407016937185280,2017-10-20 16:05:26,b'This special #INsecurityCon offer expires today! https://t.co/lVUOhleWfU https://t.co/5Ln3sP9vxL'
921402025874731008,2017-10-20 15:45:36,b'Overlay Technique from Brazilian Banking Trojans Making Resurgence https://t.co/obFVyTx1Gw'
921402025761476614,2017-10-20 15:45:36,b'How to Talk to the C-Suite about Malware Trends https://t.co/HkBGneemfF'
921394406263009280,2017-10-20 15:15:19,b'#INsecurityCon is coming to the DC area next month. Do you have your pass yet?\nhttps://t.co/oACO6hHv3H'
921376804677578757,2017-10-20 14:05:23,"b'Join the former General Counsel to the Director of National Intelligence, Bob Litt, at #INsecurityCon next month!\xe2\x80\xa6 https://t.co/KJhKkhCE8c'"
921130312679198720,2017-10-19 21:45:54,"b""'BoundHook' Technique Enables Attacker Persistence on Windows Systems https://t.co/J0rKtPfpzL"""
921085144164917249,2017-10-19 18:46:25,b'10 Social Engineering Attacks Your End Users Need to Know About https://t.co/wIbBuGEDTI'
921054779043991553,2017-10-19 16:45:46,b'IoT Deployment Security Top Concern for Enterprises https://t.co/Pc5spDVq79'
921050902026440704,2017-10-19 16:30:21,"b'Catch Security Engineering Manager, @Sam_E_Davison of @snap at #INsecurityCon next month! https://t.co/6CF2Xm2vcX https://t.co/ivpklN9hky'"
921028477792538626,2017-10-19 15:01:15,b'@NTTSecurity_US goes after the weak link in this #INsecurityCon Business Hall Theater Session. Get more info:\xe2\x80\xa6 https://t.co/yL3RwuRVTN'
921024592323469312,2017-10-19 14:45:49,"b""What's Next after the SEC 'Insider Trading' Breach? https://t.co/tJX4G48oVb"""
921009394246135808,2017-10-19 13:45:25,b'CISOs: Striving Toward Proactive Security Strategies https://t.co/4rBHKW6CA3'
921009394128736257,2017-10-19 13:45:25,b'New Locky Ransomware Strain Emerges https://t.co/dzDD5Jm4CY'
920797987466485760,2017-10-18 23:45:22,b'Malicious Minecraft Apps on Google Android Could Turn Devices into Bots https://t.co/bG3CPwsmsO'
920767912406929410,2017-10-18 21:45:52,b'Oracle Fixes 20 Remotely Exploitable Java SE Vulns https://t.co/gJ0pwN4zKp'
920737604642967553,2017-10-18 19:45:26,b'Game Change: Meet the Mach37 Fall Startups https://t.co/WuOv0zzhHz'
920731277795516416,2017-10-18 19:20:17,"b""Get a free copy of Andrew McAfee's book, Machine, Platform, Crowd: Harnessing Our Digital Future:\xe2\x80\xa6 https://t.co/H4HqLnRIQm"""
920722770136363008,2017-10-18 18:46:29,b'The Future of Democratic Threats is Digital https://t.co/PVA0ahaPcP'
920703634400215040,2017-10-18 17:30:26,"b'Catch the Founder and CEO of @illusivenw, Ofer Israeli, at #INsecurityCon this Nov.: https://t.co/UMiOwIxPlb https://t.co/6pw2npuVpC'"
920677254551744513,2017-10-18 15:45:37,"b""'Hacker Door' RAT Resurfaces https://t.co/wFWNZEGZsZ"""
920677254283382784,2017-10-18 15:45:37,"b""What's Next After HTTPS: A Fully Encrypted Web? https://t.co/834yuaJjIE"""
920651077418192897,2017-10-18 14:01:36,b'Why attend #INsecurityCon? 4 tracks that address your top security challenges and much more: https://t.co/2Fil8INBp0'
920405486981275648,2017-10-17 21:45:43,b'ATM Machine Malware Sold on Dark Web https://t.co/4r1Cf9btGy'
920405486733840384,2017-10-17 21:45:43,"b""Reuters: Microsoft's 2013 Breach Hit Bug Repository, Insiders Say https://t.co/sS7QJjUHMw"""
920405486599573504,2017-10-17 21:45:42,b'Banking Sector on Brink of Broad Use of Blockchain https://t.co/qaYhVlgA1U'
920360372921688065,2017-10-17 18:46:27,b'Google Bolsters Security for Select Groups https://t.co/aBB9EWtq74'
920341254872948738,2017-10-17 17:30:28,"b'CISO of @OpaqNetworks, John Terrill, to speak at #INsecurityCon | Preventing Lateral Movement In Your IT Environmen\xe2\x80\xa6 https://t.co/ALnbrKoA8w'"
920332952340451328,2017-10-17 16:57:29,"b'RT @RoselleSafran: #INsecurityCon: The ""East Coast RSA"" #cybersecurity conference.\n#infosec #infosecurity #CyberAware https://t.co/Ud5rxjFh\xe2\x80\xa6'"
920330040642072576,2017-10-17 16:45:55,b'InfoSec Pros Among Worst Offenders of Employer Snooping https://t.co/EVF9MO70u7'
920313099227451392,2017-10-17 15:38:36,"b""RT @darkreadingtim: It's time to change the conversation around cybersecurity. Let's talk about defense practices. #INsecurityCon  https://\xe2\x80\xa6"""
920303728980316163,2017-10-17 15:01:22,b'Rub elbows with the best minds in enterprise security at #INsecurityCon: https://t.co/8Kp8vdKU8l'
920299912520138753,2017-10-17 14:46:12,"b""Why Security Leaders Can't Afford to Be Just 'Left-Brained' https://t.co/HwLSVAF2mR"""
920073275476193280,2017-10-16 23:45:37,b'Secure Wifi Hijacked by KRACK Vulns in WPA2 https://t.co/pDRJouTlbr'
920043047026679808,2017-10-16 21:45:30,b'US Supreme Court to Hear Microsoft-DOJ Email Case https://t.co/5bQh0syhpA'
920028064356106240,2017-10-16 20:45:58,b'@DarkReading: 20 Questions to Ask Yourself before Giving a Security Conference Talk https://t.co/yFQmQ2xw6D by @ananalytical'
920028008819363841,2017-10-16 20:45:45,"b'DHS to Require All Fed Agencies to Use DMARC, HTTPS, and STARTTLS https://t.co/LgpOuZhAeA'"
919997835956846593,2017-10-16 18:45:51,b'New Adobe Flash ZeroDay Used To Plant Surveillance Software https://t.co/5PIsyOLfvp'
919997835935911937,2017-10-16 18:45:51,"b""New Cybercrime Campaign a 'Clear and Imminent' Threat to Banks Worldwide https://t.co/ZgAoZKACrd"""
919982701976936449,2017-10-16 17:45:43,b'GDPR Compliance: 5 Early Steps to Get Laggards Going https://t.co/Ra1wsviGiP'
919978834165977088,2017-10-16 17:30:21,"b'President of @IPArchiTechs, John Pironti, will be speaking at #INsecurityCon next month. Welcome @jpironti!\xe2\x80\xa6 https://t.co/SR8BPiwifB'"
919967646333984768,2017-10-16 16:45:53,b'20 Questions to Ask Yourself before Giving a Security Conference Talk https://t.co/yFQmQ2xw6D'
919937353224945664,2017-10-16 14:45:31,b'Printers: The Weak Link in Enterprise Security https://t.co/jVRnriNlyE'
919922212739670016,2017-10-16 13:45:21,b'Excited to announce @syncurity will be joining #INsecurityCon 2017!\nhttps://t.co/RSR87BlVVR'
919578938581700608,2017-10-15 15:01:18,b'Want to attend #INsecurityCon but need help convincing your boss? Our Justification Kit is here to help:  https://t.co/CUMTQkASm0'
919208809876414466,2017-10-14 14:30:33,"b""Don't forget to claim your SCREAM13 deal. Offer ends tonight: https://t.co/tvYjko534Y"""
918955982562250752,2017-10-13 21:45:54,b'DoubleLocker Delivers Unique Two-Punch Hit to Android https://t.co/OtVjFYY4N8'
918912100344434688,2017-10-13 18:51:31,b'Whaling: Anatomy of an Email Attack&gt; Learn how these scams have caused $2.3B in losses in 3 years https://t.co/c7XVIJKV6E  @Mimecast #ebook'
918910798256361473,2017-10-13 18:46:21,b'Hyatt Hit With Another Credit Card Breach https://t.co/9v9cBWDLKZ'
918910200542875650,2017-10-13 18:43:58,b'Ransomware on the Rise #eBook from @CarbonBlack_Inc offers 14 keys to stop #ransomware and defeat Locky https://t.co/Yao4voISAD'
918909112930504704,2017-10-13 18:39:39,b'Protect Data the Way Banks Protect Money: @CAinc #ebook shows how behavior-analytics can defeat credit card fraud https://t.co/zyI8FIYqkY'
